{
  "export_id": "exp-2026-10-13-001",
  "created_at": "2026-10-13T19:05:00Z",
  "method_id": "aria-visuals-001",
  "method_version": "1.0.0",
  "sources": {
    "atlas": "F:/ARiA/atlas/current",
    "atlas_version": "atlas-2026-10-09",
    "consensus_db": "F:/ARiA/consensus/consensus_combined.db",
    "consensus_db_rev": "r4821",
    "raw_dir": "F:/ARiA/raw/amherst_bruker"
  },
  "pipeline": {
    "aria_spatial": "match_targets_spatial_in_cube@2026-10-02",
    "instrument_tolerance": "1.4.0",
    "populate_consensus_combined": "2.1.0"
  },
  "samples": [
    {
      "sample_id": "CH163",
      "vendor": "Bruker",
      "acquisition_method": "diaPASEF",
      "drift_kind": "ion_mobility",
      "has_ims": true,
      "search_engine": "DIA-NN",
      "batch": "amherst-A",
      "sample_class": "HeLa",
      "role": "target",
      "n_proteins": 3664,
      "total_signal": 18200000000.0
    },
    {
      "sample_id": "CH164",
      "vendor": "Bruker",
      "acquisition_method": "diaPASEF",
      "drift_kind": "ion_mobility",
      "has_ims": true,
      "search_engine": "DIA-NN",
      "batch": "amherst-A",
      "sample_class": "HeLa",
      "role": "target",
      "n_proteins": 3512,
      "total_signal": 16100000000.0
    },
    {
      "sample_id": "CO021",
      "vendor": "Waters",
      "acquisition_method": "SONAR",
      "drift_kind": "quad_window",
      "has_ims": false,
      "search_engine": "DIA-NN",
      "batch": "colorado-B",
      "sample_class": "K562",
      "role": "target",
      "n_proteins": 2331,
      "total_signal": 7400000000.0
    },
    {
      "sample_id": "CO022",
      "vendor": "Waters",
      "acquisition_method": "HDMSE",
      "drift_kind": "ion_mobility",
      "has_ims": true,
      "search_engine": "DIA-NN",
      "batch": "colorado-B",
      "sample_class": "K562",
      "role": "target",
      "n_proteins": 2894,
      "total_signal": 9100000000.0
    },
    {
      "sample_id": "QC04",
      "vendor": "Thermo",
      "acquisition_method": "DDA",
      "drift_kind": "absent",
      "has_ims": false,
      "search_engine": "MSFragger",
      "batch": "qc",
      "sample_class": null,
      "role": "control",
      "n_proteins": 4235,
      "total_signal": 22000000000.0
    }
  ],
  "tables": {
    "ions": true,
    "proteins": true,
    "spectra": true,
    "traces": true,
    "spectrum_kinds": [
      "ms2_experimental",
      "ms2_library",
      "ms1_isotope"
    ],
    "fragment_hits": true
  },
  "quant": {
    "metric": "top3avg",
    "absolute_standard_declared": false,
    "normalizations": [
      "median_scaled",
      "within_protein_max"
    ]
  },
  "counts": {
    "ions_total": 2140883,
    "ions_exported": 60000,
    "by_tier": {
      "bare_proximity": 0,
      "pass2_confirmed": 58211,
      "atlas_consensus": 1789
    }
  },
  "proximity_control": {
    "axes_matched": [
      "mz",
      "charge",
      "rt"
    ],
    "n_peaks_queryable": 37,
    "mz_range": [
      444.2202085,
      1514.2602085
    ],
    "charges_seen": [
      2
    ],
    "min_scans": 2,
    "precursor_ppm": 10.0,
    "rt_tol": 0.5,
    "drift_tol": null,
    "calibration": {
      "offset_ppm": -0.01020824527795548,
      "n_targets_used": 36,
      "spread_ppm": 0.05195540378318495
    },
    "arms": {
      "target": {
        "arm": "target",
        "queried": 37,
        "matched": 37,
        "rate": 1.0,
        "ci": [
          0.9059421728185314,
          1.0
        ],
        "distinct_peaks_matched": 37,
        "excluded": {
          "no_charge": 0
        },
        "axes_matched": [
          "mz",
          "charge",
          "rt"
        ],
        "strata": [
          {
            "stratum": 0,
            "mz_lo": 444.2202,
            "mz_hi": 566.7671,
            "queried": 9,
            "matched": 9,
            "rate": 1.0,
            "ci": [
              0.700854948272956,
              1.0
            ]
          },
          {
            "stratum": 1,
            "mz_lo": 570.3031,
            "mz_hi": 626.8799,
            "queried": 9,
            "matched": 9,
            "rate": 1.0,
            "ci": [
              0.700854948272956,
              1.0
            ]
          },
          {
            "stratum": 2,
            "mz_lo": 660.8231,
            "mz_hi": 844.9155,
            "queried": 9,
            "matched": 9,
            "rate": 1.0,
            "ci": [
              0.700854948272956,
              1.0
            ]
          },
          {
            "stratum": 3,
            "mz_lo": 851.4565,
            "mz_hi": 1514.2602,
            "queried": 10,
            "matched": 10,
            "rate": 1.0,
            "ci": [
              0.7224671969739421,
              1.0
            ]
          }
        ],
        "note": null,
        "ratio_vs_target": null
      },
      "entrapment": {
        "arm": "entrapment",
        "queried": 41,
        "matched": 0,
        "rate": 0.0,
        "ci": [
          0.0,
          0.08566757142012449
        ],
        "distinct_peaks_matched": 0,
        "excluded": {
          "out_of_range": 1,
          "unseen_charge": 0,
          "self_match": 0,
          "degenerate_with_a_target": 0,
          "unmassable": 0
        },
        "axes_matched": [
          "mz",
          "charge",
          "rt"
        ],
        "strata": [
          {
            "stratum": 0,
            "mz_lo": 491.28999848479117,
            "mz_hi": 510.27962829094037,
            "queried": 10,
            "matched": 0,
            "rate": 0.0,
            "ci": [
              0.0,
              0.2775328030260577
            ]
          },
          {
            "stratum": 1,
            "mz_lo": 514.2927382499736,
            "mz_hi": 537.2922230151893,
            "queried": 10,
            "matched": 0,
            "rate": 0.0,
            "ci": [
              0.0,
              0.2775328030260577
            ]
          },
          {
            "stratum": 2,
            "mz_lo": 537.2922230151893,
            "mz_hi": 608.8302172849119,
            "queried": 10,
            "matched": 0,
            "rate": 0.0,
            "ci": [
              0.0,
              0.2775328030260577
            ]
          },
          {
            "stratum": 3,
            "mz_lo": 608.8302172849119,
            "mz_hi": 1106.055622209113,
            "queried": 11,
            "matched": 0,
            "rate": 0.0,
            "ci": [
              0.0,
              0.25883296999442634
            ]
          }
        ],
        "note": null,
        "ratio_vs_target": null
      },
      "calc_target": {
        "arm": "calc_target",
        "queried": 36,
        "matched": 35,
        "rate": 0.9722222222222222,
        "ci": [
          0.8583028121147521,
          0.9950795929146393
        ],
        "distinct_peaks_matched": 35,
        "excluded": {
          "no_sequence": 1,
          "out_of_range": 0,
          "unseen_charge": 0
        },
        "axes_matched": [
          "mz",
          "charge",
          "rt"
        ],
        "strata": [
          {
            "stratum": 0,
            "mz_lo": 444.2202085,
            "mz_hi": 566.7670985000001,
            "queried": 9,
            "matched": 9,
            "rate": 1.0,
            "ci": [
              0.700854948272956,
              1.0
            ]
          },
          {
            "stratum": 1,
            "mz_lo": 570.3031235000001,
            "mz_hi": 660.8231335,
            "queried": 9,
            "matched": 9,
            "rate": 1.0,
            "ci": [
              0.700854948272956,
              1.0
            ]
          },
          {
            "stratum": 2,
            "mz_lo": 665.8229285000001,
            "mz_hi": 851.4565035,
            "queried": 9,
            "matched": 8,
            "rate": 0.8888888888888888,
            "ci": [
              0.565000291629209,
              0.9801091125830901
            ]
          },
          {
            "stratum": 3,
            "mz_lo": 859.9446435000001,
            "mz_hi": 1514.2602085,
            "queried": 9,
            "matched": 9,
            "rate": 1.0,
            "ci": [
              0.700854948272956,
              1.0
            ]
          }
        ],
        "note": null,
        "ratio_vs_target": [
          0.9733175838542818,
          1.0869619548883644
        ]
      },
      "swap": {
        "arm": "swap",
        "queried": 37,
        "matched": 0,
        "rate": 0.0,
        "ci": [
          0.0,
          0.09405782718146873
        ],
        "distinct_peaks_matched": 0,
        "excluded": {
          "no_distant_partner": 0,
          "no_coordinate": 0
        },
        "axes_matched": [
          "mz",
          "charge",
          "rt"
        ],
        "strata": [
          {
            "stratum": 0,
            "mz_lo": 444.2202,
            "mz_hi": 566.7671,
            "queried": 9,
            "matched": 0,
            "rate": 0.0,
            "ci": [
              0.0,
              0.2991450517270439
            ]
          },
          {
            "stratum": 1,
            "mz_lo": 570.3031,
            "mz_hi": 626.8799,
            "queried": 9,
            "matched": 0,
            "rate": 0.0,
            "ci": [
              0.0,
              0.2991450517270439
            ]
          },
          {
            "stratum": 2,
            "mz_lo": 660.8231,
            "mz_hi": 844.9155,
            "queried": 9,
            "matched": 0,
            "rate": 0.0,
            "ci": [
              0.0,
              0.2991450517270439
            ]
          },
          {
            "stratum": 3,
            "mz_lo": 851.4565,
            "mz_hi": 1514.2602,
            "queried": 10,
            "matched": 0,
            "rate": 0.0,
            "ci": [
              0.0,
              0.2775328030260577
            ]
          }
        ],
        "note": null,